{
  "created_at": "2026-09-09T04:00:00Z",
  "agent_id": "agent-codex",
  "provider_source": "replay:fixture-v1",
  "workload_id": "original.bug-fix",
  "workload_revision": "asb-original-v1",
  "platform_id": "linux-x86_64",
  "result_integrity": "verified",
  "outcome": "completed",
  "unavailable_reasons": []
}
